<!ELEMENT hospital (patient*)>
<!ELEMENT patient (patname,patid,patage,disease,tdname,roomno)>
<!ELEMENT patname (#PCDATA)>
<!ELEMENT patid (#PCDATA)>
<!ELEMENT patage (#PCDATA)>
<!ELEMENT disease (#PCDATA)>
<!ELEMENT tdname (#PCDATA)>
<!ELEMENT roomno (#PCDATA)>